"Timestamp","Source IP Address","Destination IP Address","Source Port","Destination Port","Protocol","Packet Length","Traffic Type","Packet Type","Payload Data","Info"
"2024-06-23 21:55:04","fd13:5d43:c0d1:0:f12b:fe1a:d894:cc03","fd13:5d43:c0d1::1","63389","53","DNS","88","eth:ethertype:ipv6:udp:dns","88","","Standard query 0x8df5 A wpad.lan"
"2024-06-23 21:55:04","fd13:5d43:c0d1::1","fd13:5d43:c0d1:0:f12b:fe1a:d894:cc03","53","63389","DNS","88","eth:ethertype:ipv6:udp:dns","88","","Standard query response 0x8df5 No such name A wpad.lan"
"2024-06-23 21:55:04","fd13:5d43:c0d1:0:f12b:fe1a:d894:cc03","fd13:5d43:c0d1::1","53633","53","DNS","88","eth:ethertype:ipv6:udp:dns","88","","Standard query 0xe3ac A wpad.lan"
"2024-06-23 21:55:04","fd13:5d43:c0d1:0:f12b:fe1a:d894:cc03","fd13:5d43:c0d1::1","51833","53","DNS","88","eth:ethertype:ipv6:udp:dns","88","","Standard query 0xbd68 AAAA wpad.lan"
"2024-06-23 21:55:04","fd13:5d43:c0d1:0:f12b:fe1a:d894:cc03","fd13:5d43:c0d1::1","59550","53","DNS","88","eth:ethertype:ipv6:udp:dns","88","","Standard query 0x947c AAAA wpad.lan"
"2024-06-23 21:55:04","fd13:5d43:c0d1::1","fd13:5d43:c0d1:0:f12b:fe1a:d894:cc03","53","53633","DNS","88","eth:ethertype:ipv6:udp:dns","88","","Standard query response 0xe3ac No such name A wpad.lan"
"2024-06-23 21:55:04","fd13:5d43:c0d1::1","fd13:5d43:c0d1:0:f12b:fe1a:d894:cc03","53","51833","DNS","88","eth:ethertype:ipv6:udp:dns","88","","Standard query response 0xbd68 No such name AAAA wpad.lan"
"2024-06-23 21:55:04","fd13:5d43:c0d1::1","fd13:5d43:c0d1:0:f12b:fe1a:d894:cc03","53","59550","DNS","88","eth:ethertype:ipv6:udp:dns","88","","Standard query response 0x947c No such name AAAA wpad.lan"
"2024-06-23 21:55:04","172.16.42.196","255.255.255.255","1046","1046","UDP","67","eth:ethertype:ip:udp:data","67","72635f69616d686572653a363535353a303a303a4544444945","1046  >  1046 Len=25"
"2024-06-23 21:55:04","172.16.42.196","192.168.1.101","51716","6555","TCP","66","eth:ethertype:ip:tcp","66","","51716  >  6555 [SYN] Seq=0 Win=64240 Len=0 MSS=1460 WS=256 SACK_PERM"
"2024-06-23 21:55:05","172.16.42.196","255.255.255.255","1046","1046","UDP","67","eth:ethertype:ip:udp:data","67","72635f69616d686572653a363535353a303a303a4544444945","1046  >  1046 Len=25"
"2024-06-23 21:55:05","172.16.42.196","192.168.1.101","51717","6555","TCP","66","eth:ethertype:ip:tcp","66","","51717  >  6555 [SYN] Seq=0 Win=64240 Len=0 MSS=1460 WS=256 SACK_PERM"
"2024-06-23 21:55:06","172.16.42.196","255.255.255.255","1046","1046","UDP","67","eth:ethertype:ip:udp:data","67","72635f69616d686572653a363535353a303a303a4544444945","1046  >  1046 Len=25"
"2024-06-23 21:55:06","172.16.42.196","192.168.1.101","51718","6555","TCP","66","eth:ethertype:ip:tcp","66","","51718  >  6555 [SYN] Seq=0 Win=64240 Len=0 MSS=1460 WS=256 SACK_PERM"
"2024-06-23 21:55:06","172.16.42.196","172.16.42.1","51709","1471","TCP","60","eth:ethertype:ip:tcp","60","","51709  >  1471 [FIN, ACK] Seq=1 Ack=1 Win=4095 Len=0"
"2024-06-23 21:55:06","172.16.42.1","172.16.42.196","1471","51709","TCP","54","eth:ethertype:ip:tcp","54","","1471  >  51709 [FIN, ACK] Seq=1 Ack=2 Win=2003 Len=0"
"2024-06-23 21:55:06","172.16.42.196","172.16.42.1","51708","1471","TCP","60","eth:ethertype:ip:tcp","60","","51708  >  1471 [FIN, ACK] Seq=1 Ack=1 Win=4100 Len=0"
"2024-06-23 21:55:06","172.16.42.196","172.16.42.1","51709","1471","TCP","60","eth:ethertype:ip:tcp","60","","51709  >  1471 [ACK] Seq=2 Ack=2 Win=4095 Len=0"
"2024-06-23 21:55:06","172.16.42.1","172.16.42.196","1471","51708","TCP","54","eth:ethertype:ip:tcp","54","","1471  >  51708 [FIN, ACK] Seq=1 Ack=2 Win=2003 Len=0"
"2024-06-23 21:55:06","172.16.42.196","172.16.42.1","51708","1471","TCP","60","eth:ethertype:ip:tcp","60","","51708  >  1471 [ACK] Seq=2 Ack=2 Win=4100 Len=0"
"2024-06-23 21:55:07","172.16.42.196","255.255.255.255","1046","1046","UDP","67","eth:ethertype:ip:udp:data","67","72635f69616d686572653a363535353a303a303a4544444945","1046  >  1046 Len=25"
"2024-06-23 21:55:07","172.16.42.196","192.168.1.101","51719","6555","TCP","66","eth:ethertype:ip:tcp","66","","51719  >  6555 [SYN] Seq=0 Win=64240 Len=0 MSS=1460 WS=256 SACK_PERM"
"2024-06-23 21:55:07","192.168.1.9","172.16.42.196","51716","6555","ICMP","94","eth:ethertype:ip:icmp:ip:tcp","94","","Destination unreachable (Host unreachable)"
"2024-06-23 21:55:07","192.168.1.9","172.16.42.196","51717","6555","ICMP","94","eth:ethertype:ip:icmp:ip:tcp","94","","Destination unreachable (Host unreachable)"
"2024-06-23 21:55:07","192.168.1.9","172.16.42.196","51718","6555","ICMP","94","eth:ethertype:ip:icmp:ip:tcp","94","","Destination unreachable (Host unreachable)"
"2024-06-23 21:55:07","192.168.1.9","172.16.42.196","51719","6555","ICMP","94","eth:ethertype:ip:icmp:ip:tcp","94","","Destination unreachable (Host unreachable)"
"2024-06-23 21:55:07","172.16.42.196","172.16.42.1","51720","1471","TCP","66","eth:ethertype:ip:tcp","66","","51720  >  1471 [SYN] Seq=0 Win=64240 Len=0 MSS=1460 WS=256 SACK_PERM"
"2024-06-23 21:55:07","172.16.42.1","172.16.42.196","1471","51720","TCP","66","eth:ethertype:ip:tcp","66","","1471  >  51720 [SYN, ACK] Seq=0 Ack=1 Win=64240 Len=0 MSS=1460 SACK_PERM WS=32"
"2024-06-23 21:55:07","172.16.42.196","172.16.42.1","51720","1471","TCP","60","eth:ethertype:ip:tcp","60","","51720  >  1471 [ACK] Seq=1 Ack=1 Win=1049600 Len=0"
"2024-06-23 21:55:07","172.16.42.196","172.16.42.1","51720","1471","HTTP","1153","eth:ethertype:ip:tcp:http","1153","","GET /api/status HTTP/1.1 "
"2024-06-23 21:55:07","172.16.42.1","172.16.42.196","1471","51720","TCP","54","eth:ethertype:ip:tcp","54","","1471  >  51720 [ACK] Seq=1 Ack=1100 Win=64096 Len=0"
"2024-06-23 21:55:07","172.16.42.1","172.16.42.196","1471","51720","HTTP","445","eth:ethertype:ip:tcp:http:media","445","","HTTP/1.1 200 OK  (text/json)"
"2024-06-23 21:55:07","172.16.42.196","172.16.42.1","51721","1471","TCP","66","eth:ethertype:ip:tcp","66","","51721  >  1471 [SYN] Seq=0 Win=64240 Len=0 MSS=1460 WS=256 SACK_PERM"
"2024-06-23 21:55:07","172.16.42.1","172.16.42.196","1471","51721","TCP","66","eth:ethertype:ip:tcp","66","","1471  >  51721 [SYN, ACK] Seq=0 Ack=1 Win=64240 Len=0 MSS=1460 SACK_PERM WS=32"
"2024-06-23 21:55:07","172.16.42.196","172.16.42.1","51721","1471","TCP","60","eth:ethertype:ip:tcp","60","","51721  >  1471 [ACK] Seq=1 Ack=1 Win=1049600 Len=0"
"2024-06-23 21:55:07","172.16.42.196","172.16.42.1","51720","1471","HTTP","1160","eth:ethertype:ip:tcp:http","1160","","GET /api/notifications HTTP/1.1 "
"2024-06-23 21:55:07","172.16.42.1","172.16.42.196","1471","51720","TCP","54","eth:ethertype:ip:tcp","54","","1471  >  51720 [ACK] Seq=392 Ack=2206 Win=64096 Len=0"
"2024-06-23 21:55:07","172.16.42.196","172.16.42.1","51721","1471","HTTP","1153","eth:ethertype:ip:tcp:http","1153","","GET /api/status HTTP/1.1 "
"2024-06-23 21:55:07","172.16.42.1","172.16.42.196","1471","51721","TCP","54","eth:ethertype:ip:tcp","54","","1471  >  51721 [ACK] Seq=1 Ack=1100 Win=64096 Len=0"
"2024-06-23 21:55:07","172.16.42.1","172.16.42.196","1471","51720","HTTP","1153","eth:ethertype:ip:tcp:http:media","1153","","HTTP/1.1 200 OK  (text/json)"
"2024-06-23 21:55:07","172.16.42.196","172.16.42.1","51720","1471","TCP","60","eth:ethertype:ip:tcp","60","","51720  >  1471 [ACK] Seq=2206 Ack=1491 Win=1049600 Len=0"
"2024-06-23 21:55:08","172.16.42.1","172.16.42.196","1471","51721","HTTP","445","eth:ethertype:ip:tcp:http:media","445","","HTTP/1.1 200 OK  (text/json)"
"2024-06-23 21:55:08","172.16.42.196","172.16.42.1","51721","1471","TCP","60","eth:ethertype:ip:tcp","60","","51721  >  1471 [ACK] Seq=1100 Ack=392 Win=1049344 Len=0"
"2024-06-23 21:55:08","172.16.42.196","172.16.42.1","51721","1471","HTTP/JSON","1335","eth:ethertype:ip:tcp:http:json","1335","","POST /api/module/request HTTP/1.1 , JSON (application/json)"
"2024-06-23 21:55:08","172.16.42.1","172.16.42.196","1471","51721","TCP","54","eth:ethertype:ip:tcp","54","","1471  >  51721 [ACK] Seq=392 Ack=2381 Win=64096 Len=0"
"2024-06-23 21:55:08","172.16.42.196","255.255.255.255","1046","1046","UDP","67","eth:ethertype:ip:udp:data","67","72635f69616d686572653a363535353a303a303a4544444945","1046  >  1046 Len=25"
"2024-06-23 21:55:08","172.16.42.196","192.168.1.101","51722","6555","TCP","66","eth:ethertype:ip:tcp","66","","51722  >  6555 [SYN] Seq=0 Win=64240 Len=0 MSS=1460 WS=256 SACK_PERM"
"2024-06-23 21:55:08","172.16.42.1","172.16.42.196","1471","51721","HTTP","262","eth:ethertype:ip:tcp:http:media","262","","HTTP/1.1 200 OK  (text/json)"
"2024-06-23 21:55:08","172.16.42.196","172.16.42.1","51721","1471","HTTP/JSON","1294","eth:ethertype:ip:tcp:http:json","1294","","POST /api/module/request HTTP/1.1 , JSON (application/json)"
"2024-06-23 21:55:08","172.16.42.1","172.16.42.196","1471","51721","TCP","54","eth:ethertype:ip:tcp","54","","1471  >  51721 [ACK] Seq=600 Ack=3621 Win=64096 Len=0"
"2024-06-23 21:55:08","172.16.42.1","172.16.42.196","1471","51721","HTTP","333","eth:ethertype:ip:tcp:http:media","333","","HTTP/1.1 200 OK  (text/json)"
"2024-06-23 21:55:08","172.16.42.196","172.16.42.1","51721","1471","TCP","60","eth:ethertype:ip:tcp","60","","51721  >  1471 [ACK] Seq=3621 Ack=879 Win=1048832 Len=0"
"2024-06-23 21:55:09","172.16.42.196","255.255.255.255","1046","1046","UDP","67","eth:ethertype:ip:udp:data","67","72635f69616d686572653a363535353a303a303a4544444945","1046  >  1046 Len=25"
"2024-06-23 21:55:09","172.16.42.196","192.168.1.101","51723","6555","TCP","66","eth:ethertype:ip:tcp","66","","51723  >  6555 [SYN] Seq=0 Win=64240 Len=0 MSS=1460 WS=256 SACK_PERM"
"2024-06-23 21:55:10","20.127.250.238","172.16.42.196","443","54560","TLSv1.2","113","eth:ethertype:ip:tcp:tls","113","","Application Data"
"2024-06-23 21:55:10","172.16.42.196","20.127.250.238","54560","443","TLSv1.2","120","eth:ethertype:ip:tcp:tls","120","","Application Data"
"2024-06-23 21:55:10","172.16.42.196","255.255.255.255","1046","1046","UDP","67","eth:ethertype:ip:udp:data","67","72635f69616d686572653a363535353a303a303a4544444945","1046  >  1046 Len=25"
"2024-06-23 21:55:10","172.16.42.196","192.168.1.101","51724","6555","TCP","66","eth:ethertype:ip:tcp","66","","51724  >  6555 [SYN] Seq=0 Win=64240 Len=0 MSS=1460 WS=256 SACK_PERM"
"2024-06-23 21:55:10","20.127.250.238","172.16.42.196","443","54560","TCP","54","eth:ethertype:ip:tcp","54","","443  >  54560 [ACK] Seq=60 Ack=67 Win=251 Len=0"
"2024-06-23 21:55:11","172.16.42.196","255.255.255.255","1046","1046","UDP","67","eth:ethertype:ip:udp:data","67","72635f69616d686572653a363535353a303a303a4544444945","1046  >  1046 Len=25"
"2024-06-23 21:55:11","172.16.42.196","192.168.1.101","51725","6555","TCP","66","eth:ethertype:ip:tcp","66","","51725  >  6555 [SYN] Seq=0 Win=64240 Len=0 MSS=1460 WS=256 SACK_PERM"
"2024-06-23 21:55:11","192.168.1.9","172.16.42.196","51722","6555","ICMP","94","eth:ethertype:ip:icmp:ip:tcp","94","","Destination unreachable (Host unreachable)"
"2024-06-23 21:55:11","192.168.1.9","172.16.42.196","51723","6555","ICMP","94","eth:ethertype:ip:icmp:ip:tcp","94","","Destination unreachable (Host unreachable)"
"2024-06-23 21:55:11","192.168.1.9","172.16.42.196","51724","6555","ICMP","94","eth:ethertype:ip:icmp:ip:tcp","94","","Destination unreachable (Host unreachable)"
"2024-06-23 21:55:11","192.168.1.9","172.16.42.196","51725","6555","ICMP","94","eth:ethertype:ip:icmp:ip:tcp","94","","Destination unreachable (Host unreachable)"
"2024-06-23 21:55:11","172.64.155.141","172.16.42.196","443","51283","TLSv1.2","78","eth:ethertype:ip:tcp:tls","78","","Application Data"
"2024-06-23 21:55:11","172.16.42.196","172.64.155.141","51283","443","TLSv1.2","82","eth:ethertype:ip:tcp:tls","82","","Application Data"
"2024-06-23 21:55:11","172.64.155.141","172.16.42.196","443","51283","TCP","54","eth:ethertype:ip:tcp","54","","443  >  51283 [ACK] Seq=25 Ack=29 Win=5 Len=0"
"2024-06-23 21:55:12","172.16.42.196","255.255.255.255","1046","1046","UDP","67","eth:ethertype:ip:udp:data","67","72635f69616d686572653a363535353a303a303a4544444945","1046  >  1046 Len=25"
"2024-06-23 21:55:12","172.16.42.196","192.168.1.101","51726","6555","TCP","66","eth:ethertype:ip:tcp","66","","51726  >  6555 [SYN] Seq=0 Win=64240 Len=0 MSS=1460 WS=256 SACK_PERM"
"2024-06-23 21:55:12","172.16.42.196","172.16.42.1","51721","1471","HTTP","1160","eth:ethertype:ip:tcp:http","1160","","GET /api/notifications HTTP/1.1 "
"2024-06-23 21:55:12","172.16.42.1","172.16.42.196","1471","51721","TCP","54","eth:ethertype:ip:tcp","54","","1471  >  51721 [ACK] Seq=879 Ack=4727 Win=64096 Len=0"
"2024-06-23 21:55:12","172.16.42.1","172.16.42.196","1471","51721","HTTP","1153","eth:ethertype:ip:tcp:http:media","1153","","HTTP/1.1 200 OK  (text/json)"
"2024-06-23 21:55:12","172.16.42.196","172.16.42.1","51721","1471","TCP","60","eth:ethertype:ip:tcp","60","","51721  >  1471 [ACK] Seq=4727 Ack=1978 Win=1049600 Len=0"
"2024-06-23 21:55:13","172.16.42.196","172.16.42.1","51721","1471","HTTP/JSON","1335","eth:ethertype:ip:tcp:http:json","1335","","POST /api/module/request HTTP/1.1 , JSON (application/json)"
"2024-06-23 21:55:13","172.16.42.1","172.16.42.196","1471","51721","TCP","54","eth:ethertype:ip:tcp","54","","1471  >  51721 [ACK] Seq=1978 Ack=6008 Win=64096 Len=0"
"2024-06-23 21:55:13","172.16.42.196","255.255.255.255","1046","1046","UDP","67","eth:ethertype:ip:udp:data","67","72635f69616d686572653a363535353a303a303a4544444945","1046  >  1046 Len=25"
"2024-06-23 21:55:13","172.16.42.196","192.168.1.101","51727","6555","TCP","66","eth:ethertype:ip:tcp","66","","51727  >  6555 [SYN] Seq=0 Win=64240 Len=0 MSS=1460 WS=256 SACK_PERM"
"2024-06-23 21:55:13","172.16.42.1","172.16.42.196","1471","51721","HTTP","262","eth:ethertype:ip:tcp:http:media","262","","HTTP/1.1 200 OK  (text/json)"
"2024-06-23 21:55:13","172.16.42.196","172.16.42.1","51721","1471","HTTP/JSON","1294","eth:ethertype:ip:tcp:http:json","1294","","POST /api/module/request HTTP/1.1 , JSON (application/json)"
"2024-06-23 21:55:13","172.16.42.1","172.16.42.196","1471","51721","TCP","54","eth:ethertype:ip:tcp","54","","1471  >  51721 [ACK] Seq=2186 Ack=7248 Win=64096 Len=0"
"2024-06-23 21:55:14","172.16.42.1","172.16.42.196","1471","51721","HTTP","373","eth:ethertype:ip:tcp:http:media","373","","HTTP/1.1 200 OK  (text/json)"
"2024-06-23 21:55:14","172.16.42.196","172.16.42.1","51721","1471","TCP","60","eth:ethertype:ip:tcp","60","","51721  >  1471 [ACK] Seq=7248 Ack=2505 Win=1049088 Len=0"
"2024-06-23 21:55:14","172.16.42.196","255.255.255.255","1046","1046","UDP","67","eth:ethertype:ip:udp:data","67","72635f69616d686572653a363535353a303a303a4544444945","1046  >  1046 Len=25"
"2024-06-23 21:55:14","172.16.42.196","192.168.1.101","51728","6555","TCP","66","eth:ethertype:ip:tcp","66","","51728  >  6555 [SYN] Seq=0 Win=64240 Len=0 MSS=1460 WS=256 SACK_PERM"
"2024-06-23 21:55:14","fe80::ffff:ffff:fffe","ff02::2","50639","3544","ICMPv6","103","eth:ethertype:ip:udp:teredo:ipv6:icmpv6","103","","Router Solicitation"
"2024-06-23 21:55:15","172.16.42.196","255.255.255.255","1046","1046","UDP","67","eth:ethertype:ip:udp:data","67","72635f69616d686572653a363535353a303a303a4544444945","1046  >  1046 Len=25"
"2024-06-23 21:55:15","172.16.42.196","192.168.1.101","51729","6555","TCP","66","eth:ethertype:ip:tcp","66","","51729  >  6555 [SYN] Seq=0 Win=64240 Len=0 MSS=1460 WS=256 SACK_PERM"
"2024-06-23 21:55:15","192.168.1.9","172.16.42.196","51726","6555","ICMP","94","eth:ethertype:ip:icmp:ip:tcp","94","","Destination unreachable (Host unreachable)"
"2024-06-23 21:55:15","192.168.1.9","172.16.42.196","51727","6555","ICMP","94","eth:ethertype:ip:icmp:ip:tcp","94","","Destination unreachable (Host unreachable)"
"2024-06-23 21:55:15","192.168.1.9","172.16.42.196","51728","6555","ICMP","94","eth:ethertype:ip:icmp:ip:tcp","94","","Destination unreachable (Host unreachable)"
"2024-06-23 21:55:15","192.168.1.9","172.16.42.196","51729","6555","ICMP","94","eth:ethertype:ip:icmp:ip:tcp","94","","Destination unreachable (Host unreachable)"
"2024-06-23 21:55:15","fe80::8000:f227:d788:f855","fe80::ffff:ffff:fffe","3544","50639","ICMPv6","151","eth:ethertype:ip:udp:teredo:ipv6:icmpv6","151","","Router Advertisement"
"2024-06-23 21:55:16","172.16.42.196","255.255.255.255","1046","1046","UDP","67","eth:ethertype:ip:udp:data","67","72635f69616d686572653a363535353a303a303a4544444945","1046  >  1046 Len=25"
"2024-06-23 21:55:16","172.16.42.196","192.168.1.101","51730","6555","TCP","66","eth:ethertype:ip:tcp","66","","51730  >  6555 [SYN] Seq=0 Win=64240 Len=0 MSS=1460 WS=256 SACK_PERM"
"2024-06-23 21:55:16","172.16.42.196","172.16.42.1","51720","1471","TCP","60","eth:ethertype:ip:tcp","60","","51720  >  1471 [FIN, ACK] Seq=2206 Ack=1491 Win=1049600 Len=0"
"2024-06-23 21:55:16","172.16.42.1","172.16.42.196","1471","51720","TCP","54","eth:ethertype:ip:tcp","54","","1471  >  51720 [FIN, ACK] Seq=1491 Ack=2207 Win=64096 Len=0"
"2024-06-23 21:55:16","172.16.42.196","172.16.42.1","51721","1471","TCP","60","eth:ethertype:ip:tcp","60","","51721  >  1471 [FIN, ACK] Seq=7248 Ack=2505 Win=1049088 Len=0"
"2024-06-23 21:55:16","172.16.42.196","172.16.42.1","51720","1471","TCP","60","eth:ethertype:ip:tcp","60","","51720  >  1471 [ACK] Seq=2207 Ack=1492 Win=1049600 Len=0"
"2024-06-23 21:55:16","172.16.42.1","172.16.42.196","1471","51721","TCP","54","eth:ethertype:ip:tcp","54","","1471  >  51721 [FIN, ACK] Seq=2505 Ack=7249 Win=64096 Len=0"
"2024-06-23 21:55:16","172.16.42.196","172.16.42.1","51721","1471","TCP","60","eth:ethertype:ip:tcp","60","","51721  >  1471 [ACK] Seq=7249 Ack=2506 Win=1049088 Len=0"
"2024-06-23 21:55:17","172.16.42.196","255.255.255.255","1046","1046","UDP","67","eth:ethertype:ip:udp:data","67","72635f69616d686572653a363535353a303a303a4544444945","1046  >  1046 Len=25"
"2024-06-23 21:55:17","172.16.42.196","192.168.1.101","51731","6555","TCP","66","eth:ethertype:ip:tcp","66","","51731  >  6555 [SYN] Seq=0 Win=64240 Len=0 MSS=1460 WS=256 SACK_PERM"
"2024-06-23 21:55:17","fd13:5d43:c0d1:0:f12b:fe1a:d894:cc03","fd13:5d43:c0d1::1","53633","53","DNS","103","eth:ethertype:ipv6:udp:dns","103","","Standard query 0x935e A www.msftconnecttest.com"
"2024-06-23 21:55:17","fd13:5d43:c0d1:0:f12b:fe1a:d894:cc03","fd13:5d43:c0d1::1","52138","53","DNS","103","eth:ethertype:ipv6:udp:dns","103","","Standard query 0xb2f9 AAAA www.msftconnecttest.com"
"2024-06-23 21:55:17","fd13:5d43:c0d1::1","fd13:5d43:c0d1:0:f12b:fe1a:d894:cc03","53","53633","DNS","253","eth:ethertype:ipv6:udp:dns","253","","Standard query response 0x935e A www.msftconnecttest.com CNAME ncsi-geo.trafficmanager.net CNAME www.msftncsi.com.edgesuite.net CNAME a1961.g2.akamai.net A 200.63.193.83 A 200.63.193.73"
"2024-06-23 21:55:17","172.16.42.196","172.16.42.1","52138","53","DNS","83","eth:ethertype:ip:udp:dns","83","","Standard query 0xb2f9 AAAA www.msftconnecttest.com"
"2024-06-23 21:55:17","172.16.42.1","172.16.42.196","53","52138","DNS","201","eth:ethertype:ip:udp:dns","201","","Standard query response 0xb2f9 AAAA www.msftconnecttest.com CNAME ncsi-geo.trafficmanager.net CNAME www.msftncsi.com.edgesuite.net CNAME a1961.g2.akamai.net"
"2024-06-23 21:55:17","172.16.42.196","200.63.193.83","51732","80","TCP","66","eth:ethertype:ip:tcp","66","","51732  >  80 [SYN] Seq=0 Win=64240 Len=0 MSS=1460 WS=256 SACK_PERM"
"2024-06-23 21:55:17","fd13:5d43:c0d1::1","fd13:5d43:c0d1:0:f12b:fe1a:d894:cc03","53","52138","DNS","293","eth:ethertype:ipv6:udp:dns","293","","Standard query response 0xb2f9 AAAA www.msftconnecttest.com CNAME ncsi-geo.trafficmanager.net CNAME www.msftncsi.com.edgesuite.net CNAME a1961.g2.akamai.net SOA n0g2.akamai.net"
"2024-06-23 21:55:17","200.63.193.83","172.16.42.196","80","51732","TCP","66","eth:ethertype:ip:tcp","66","","80  >  51732 [SYN, ACK] Seq=0 Ack=1 Win=64240 Len=0 MSS=1460 SACK_PERM WS=128"
"2024-06-23 21:55:17","172.16.42.196","200.63.193.83","51732","80","TCP","60","eth:ethertype:ip:tcp","60","","51732  >  80 [ACK] Seq=1 Ack=1 Win=131328 Len=0"
"2024-06-23 21:55:17","172.16.42.196","200.63.193.83","51732","80","HTTP","165","eth:ethertype:ip:tcp:http","165","","GET /connecttest.txt HTTP/1.1 "
"2024-06-23 21:55:17","200.63.193.83","172.16.42.196","80","51732","TCP","54","eth:ethertype:ip:tcp","54","","80  >  51732 [ACK] Seq=1 Ack=112 Win=64256 Len=0"
"2024-06-23 21:55:17","200.63.193.83","172.16.42.196","80","51732","TCP","54","eth:ethertype:ip:tcp","54","","[TCP Previous segment not captured] 80  >  51732 [FIN, ACK] Seq=188 Ack=112 Win=64256 Len=0"
"2024-06-23 21:55:17","200.63.193.83","172.16.42.196","80","51732","TCP","241","eth:ethertype:ip:tcp","241","","[TCP Out-Of-Order] 80  >  51732 [PSH, ACK] Seq=1 Ack=112 Win=64256 Len=187"
"2024-06-23 21:55:17","172.16.42.196","200.63.193.83","51732","80","TCP","60","eth:ethertype:ip:tcp","60","","[TCP Dup ACK 112#1] 51732  >  80 [ACK] Seq=112 Ack=1 Win=131328 Len=0"
"2024-06-23 21:55:17","172.16.42.196","200.63.193.83","51732","80","TCP","60","eth:ethertype:ip:tcp","60","","51732  >  80 [ACK] Seq=112 Ack=189 Win=131072 Len=0"
"2024-06-23 21:55:17","172.16.42.196","200.63.193.83","51732","80","TCP","60","eth:ethertype:ip:tcp","60","","51732  >  80 [FIN, ACK] Seq=112 Ack=189 Win=131072 Len=0"
"2024-06-23 21:55:17","200.63.193.83","172.16.42.196","80","51732","TCP","54","eth:ethertype:ip:tcp","54","","80  >  51732 [ACK] Seq=189 Ack=113 Win=64256 Len=0"
"2024-06-23 21:55:17","172.16.42.196","172.16.42.1","51733","1471","TCP","66","eth:ethertype:ip:tcp","66","","51733  >  1471 [SYN] Seq=0 Win=64240 Len=0 MSS=1460 WS=256 SACK_PERM"
"2024-06-23 21:55:17","172.16.42.1","172.16.42.196","1471","51733","TCP","66","eth:ethertype:ip:tcp","66","","1471  >  51733 [SYN, ACK] Seq=0 Ack=1 Win=64240 Len=0 MSS=1460 SACK_PERM WS=32"
"2024-06-23 21:55:17","172.16.42.196","172.16.42.1","51733","1471","TCP","60","eth:ethertype:ip:tcp","60","","51733  >  1471 [ACK] Seq=1 Ack=1 Win=1049600 Len=0"
"2024-06-23 21:55:17","172.16.42.196","172.16.42.1","51733","1471","HTTP","1153","eth:ethertype:ip:tcp:http","1153","","GET /api/status HTTP/1.1 "
"2024-06-23 21:55:17","172.16.42.1","172.16.42.196","1471","51733","TCP","54","eth:ethertype:ip:tcp","54","","1471  >  51733 [ACK] Seq=1 Ack=1100 Win=64096 Len=0"
"2024-06-23 21:55:17","172.16.42.196","172.16.42.1","51734","1471","TCP","66","eth:ethertype:ip:tcp","66","","51734  >  1471 [SYN] Seq=0 Win=64240 Len=0 MSS=1460 WS=256 SACK_PERM"
"2024-06-23 21:55:17","172.16.42.1","172.16.42.196","1471","51734","TCP","66","eth:ethertype:ip:tcp","66","","1471  >  51734 [SYN, ACK] Seq=0 Ack=1 Win=64240 Len=0 MSS=1460 SACK_PERM WS=32"
"2024-06-23 21:55:17","172.16.42.196","172.16.42.1","51734","1471","TCP","60","eth:ethertype:ip:tcp","60","","51734  >  1471 [ACK] Seq=1 Ack=1 Win=1049600 Len=0"
"2024-06-23 21:55:17","172.16.42.196","172.16.42.1","51734","1471","HTTP","1160","eth:ethertype:ip:tcp:http","1160","","GET /api/notifications HTTP/1.1 "
"2024-06-23 21:55:17","172.16.42.1","172.16.42.196","1471","51734","TCP","54","eth:ethertype:ip:tcp","54","","1471  >  51734 [ACK] Seq=1 Ack=1107 Win=64096 Len=0"
"2024-06-23 21:55:17","172.16.42.1","172.16.42.196","1471","51734","HTTP","1153","eth:ethertype:ip:tcp:http:media","1153","","HTTP/1.1 200 OK  (text/json)"
"2024-06-23 21:55:17","172.16.42.1","172.16.42.196","1471","51733","HTTP","445","eth:ethertype:ip:tcp:http:media","445","","HTTP/1.1 200 OK  (text/json)"
"2024-06-23 21:55:17","172.16.42.196","172.16.42.1","51734","1471","TCP","60","eth:ethertype:ip:tcp","60","","51734  >  1471 [ACK] Seq=1107 Ack=1100 Win=1048576 Len=0"
"2024-06-23 21:55:17","172.16.42.196","172.16.42.1","51733","1471","TCP","60","eth:ethertype:ip:tcp","60","","51733  >  1471 [ACK] Seq=1100 Ack=392 Win=1049344 Len=0"
"2024-06-23 21:55:18","172.16.42.196","142.250.218.110","55299","443","QUIC","1292","eth:ethertype:ip:udp:quic:tls","1292","","Initial, DCID=85485225f5aa63e2, PKN: 1, CRYPTO"
"2024-06-23 21:55:18","172.16.42.196","142.250.218.110","55299","443","QUIC","1292","eth:ethertype:ip:udp:quic:tls","1292","","Initial, DCID=85485225f5aa63e2, PKN: 2, PING, CRYPTO, CRYPTO, CRYPTO, PING, CRYPTO, PADDING, PING, CRYPTO"
"2024-06-23 21:55:18","172.16.42.196","142.250.218.110","55299","443","QUIC","119","eth:ethertype:ip:udp:quic","119","","0-RTT, DCID=85485225f5aa63e2"
"2024-06-23 21:55:18","172.16.42.196","142.250.218.110","55299","443","QUIC","1288","eth:ethertype:ip:udp:quic","1288","","0-RTT, DCID=85485225f5aa63e2"
"2024-06-23 21:55:18","172.16.42.196","142.250.218.110","55299","443","QUIC","1292","eth:ethertype:ip:udp:quic","1292","","0-RTT, DCID=85485225f5aa63e2"
"2024-06-23 21:55:18","172.16.42.196","142.250.218.110","55299","443","QUIC","747","eth:ethertype:ip:udp:quic","747","","0-RTT, DCID=85485225f5aa63e2"
"2024-06-23 21:55:18","172.16.42.196","142.250.218.110","55299","443","QUIC","137","eth:ethertype:ip:udp:quic","137","","0-RTT, DCID=85485225f5aa63e2"
"2024-06-23 21:55:18","142.250.218.110","172.16.42.196","443","55299","QUIC","1292","eth:ethertype:ip:udp:quic","1292","","Initial, SCID=e5485225f5aa63e2, PKN: 1, ACK, PADDING"
"2024-06-23 21:55:18","172.16.42.196","172.16.42.1","51733","1471","HTTP/JSON","1335","eth:ethertype:ip:tcp:http:json","1335","","POST /api/module/request HTTP/1.1 , JSON (application/json)"
"2024-06-23 21:55:18","172.16.42.1","172.16.42.196","1471","51733","TCP","54","eth:ethertype:ip:tcp","54","","1471  >  51733 [ACK] Seq=392 Ack=2381 Win=64096 Len=0"
"2024-06-23 21:55:18","142.250.218.110","172.16.42.196","443","55299","QUIC","1292","eth:ethertype:ip:udp:quic:tls","1292","","Initial, SCID=e5485225f5aa63e2, PKN: 2, CRYPTO, PADDING"
"2024-06-23 21:55:18","142.250.218.110","172.16.42.196","443","55299","QUIC","342","eth:ethertype:ip:udp:quic","342","","Protected Payload (KP0)"
"2024-06-23 21:55:18","142.250.218.110","172.16.42.196","443","55299","QUIC","986","eth:ethertype:ip:udp:quic","986","","Protected Payload (KP0)"
"2024-06-23 21:55:18","142.250.218.110","172.16.42.196","443","55299","QUIC","67","eth:ethertype:ip:udp:quic","67","","Protected Payload (KP0)"
"2024-06-23 21:55:18","172.16.42.196","142.250.218.110","55299","443","QUIC","1292","eth:ethertype:ip:udp:quic","1292","","Handshake, DCID=e5485225f5aa63e2"
"2024-06-23 21:55:18","172.16.42.196","142.250.218.110","55299","443","QUIC","73","eth:ethertype:ip:udp:quic","73","","Protected Payload (KP0), DCID=e5485225f5aa63e2"
"2024-06-23 21:55:18","172.16.42.196","255.255.255.255","1046","1046","UDP","67","eth:ethertype:ip:udp:data","67","72635f69616d686572653a363535353a303a303a4544444945","1046  >  1046 Len=25"
"2024-06-23 21:55:18","172.16.42.196","192.168.1.101","51735","6555","TCP","66","eth:ethertype:ip:tcp","66","","51735  >  6555 [SYN] Seq=0 Win=64240 Len=0 MSS=1460 WS=256 SACK_PERM"
"2024-06-23 21:55:18","142.250.218.110","172.16.42.196","443","55299","QUIC","162","eth:ethertype:ip:udp:quic","162","","Protected Payload (KP0)"
"2024-06-23 21:55:18","142.250.218.110","172.16.42.196","443","55299","QUIC","64","eth:ethertype:ip:udp:quic","64","","Protected Payload (KP0)"
"2024-06-23 21:55:18","172.16.42.196","142.250.218.110","55299","443","QUIC","73","eth:ethertype:ip:udp:quic","73","","Protected Payload (KP0), DCID=e5485225f5aa63e2"
"2024-06-23 21:55:18","142.250.218.110","172.16.42.196","443","55299","QUIC","264","eth:ethertype:ip:udp:quic","264","","Protected Payload (KP0)"
"2024-06-23 21:55:18","142.250.218.110","172.16.42.196","443","55299","QUIC","63","eth:ethertype:ip:udp:quic","63","","Protected Payload (KP0)"
"2024-06-23 21:55:18","172.16.42.196","142.250.218.110","55299","443","QUIC","77","eth:ethertype:ip:udp:quic","77","","Protected Payload (KP0), DCID=e5485225f5aa63e2"
"2024-06-23 21:55:18","172.16.42.196","142.250.218.110","55299","443","QUIC","74","eth:ethertype:ip:udp:quic","74","","Protected Payload (KP0), DCID=e5485225f5aa63e2"
"2024-06-23 21:55:18","142.250.218.110","172.16.42.196","443","55299","QUIC","67","eth:ethertype:ip:udp:quic","67","","Protected Payload (KP0)"
"2024-06-23 21:55:18","172.16.42.1","172.16.42.196","1471","51733","HTTP","262","eth:ethertype:ip:tcp:http:media","262","","HTTP/1.1 200 OK  (text/json)"
"2024-06-23 21:55:18","172.16.42.196","172.16.42.1","51733","1471","HTTP/JSON","1294","eth:ethertype:ip:tcp:http:json","1294","","POST /api/module/request HTTP/1.1 , JSON (application/json)"
"2024-06-23 21:55:18","172.16.42.1","172.16.42.196","1471","51733","TCP","54","eth:ethertype:ip:tcp","54","","1471  >  51733 [ACK] Seq=600 Ack=3621 Win=64096 Len=0"
"2024-06-23 21:55:18","52.226.139.180","172.16.42.196","443","56710","TLSv1.2","432","eth:ethertype:ip:tcp:tls","432","","Application Data"
"2024-06-23 21:55:18","172.16.42.196","52.226.139.180","56710","443","TLSv1.2","189","eth:ethertype:ip:tcp:tls","189","","Application Data"
"2024-06-23 21:55:18","172.16.42.1","172.16.42.196","1471","51733","HTTP","415","eth:ethertype:ip:tcp:http:media","415","","HTTP/1.1 200 OK  (text/json)"
"2024-06-23 21:55:18","172.16.42.196","172.16.42.1","51733","1471","TCP","60","eth:ethertype:ip:tcp","60","","51733  >  1471 [ACK] Seq=3621 Ack=961 Win=1048576 Len=0"
"2024-06-23 21:55:18","172.16.42.196","157.240.229.60","51436","443","TCP","60","eth:ethertype:ip:tcp","60","","51436  >  443 [FIN, ACK] Seq=1 Ack=1 Win=1023 Len=0"
"2024-06-23 21:55:19","172.16.42.196","255.255.255.255","1046","1046","UDP","67","eth:ethertype:ip:udp:data","67","72635f69616d686572653a363535353a303a303a4544444945","1046  >  1046 Len=25"
"2024-06-23 21:55:19","172.16.42.196","192.168.1.101","51737","6555","TCP","66","eth:ethertype:ip:tcp","66","","51737  >  6555 [SYN] Seq=0 Win=64240 Len=0 MSS=1460 WS=256 SACK_PERM"
"2024-06-23 21:55:19","172.16.42.196","142.250.78.46","51655","443","TLSv1.2","93","eth:ethertype:ip:tcp:tls","93","","Application Data"
"2024-06-23 21:55:19","192.168.1.9","172.16.42.196","51730","6555","ICMP","94","eth:ethertype:ip:icmp:ip:tcp","94","","Destination unreachable (Host unreachable)"
"2024-06-23 21:55:19","192.168.1.9","172.16.42.196","51731","6555","ICMP","94","eth:ethertype:ip:icmp:ip:tcp","94","","Destination unreachable (Host unreachable)"
"2024-06-23 21:55:19","192.168.1.9","172.16.42.196","51735","6555","ICMP","94","eth:ethertype:ip:icmp:ip:tcp","94","","Destination unreachable (Host unreachable)"
"2024-06-23 21:55:19","192.168.1.9","172.16.42.196","51737","6555","ICMP","94","eth:ethertype:ip:icmp:ip:tcp","94","","Destination unreachable (Host unreachable)"
"2024-06-23 21:55:19","142.250.78.46","172.16.42.196","443","51655","TCP","54","eth:ethertype:ip:tcp","54","","443  >  51655 [ACK] Seq=1 Ack=40 Win=311 Len=0"
"2024-06-23 21:55:19","142.250.78.46","172.16.42.196","443","51655","TLSv1.2","93","eth:ethertype:ip:tcp:tls","93","","Application Data"
"2024-06-23 21:55:19","52.226.139.180","172.16.42.196","443","56710","TCP","54","eth:ethertype:ip:tcp","54","","443  >  56710 [ACK] Seq=379 Ack=136 Win=7407 Len=0"
"2024-06-23 21:55:19","172.16.42.196","142.250.78.46","51655","443","TCP","60","eth:ethertype:ip:tcp","60","","51655  >  443 [ACK] Seq=40 Ack=40 Win=512 Len=0"
"2024-06-23 21:55:19","172.16.42.196","157.240.229.60","51436","443","TCP","60","eth:ethertype:ip:tcp","60","","[TCP Retransmission] 51436  >  443 [FIN, ACK] Seq=1 Ack=1 Win=1023 Len=0"
"2024-06-23 21:55:19","fd13:5d43:c0d1:0:f12b:fe1a:d894:cc03","fd13:5d43:c0d1::1","63389","53","DNS","95","eth:ethertype:ipv6:udp:dns","95","","Standard query 0x8543 A e9.whatsapp.net"
"2024-06-23 21:55:19","fd13:5d43:c0d1:0:f12b:fe1a:d894:cc03","fd13:5d43:c0d1::1","49767","53","DNS","95","eth:ethertype:ipv6:udp:dns","95","","Standard query 0xdc55 AAAA e9.whatsapp.net"
"2024-06-23 21:55:19","fd13:5d43:c0d1::1","fd13:5d43:c0d1:0:f12b:fe1a:d894:cc03","53","49767","DNS","152","eth:ethertype:ipv6:udp:dns","152","","Standard query response 0xdc55 AAAA e9.whatsapp.net SOA a.ns.whatsapp.net"
"2024-06-23 21:55:19","172.16.42.196","172.16.42.1","63389","53","DNS","75","eth:ethertype:ip:udp:dns","75","","Standard query 0x8543 A e9.whatsapp.net"
"2024-06-23 21:55:19","fd13:5d43:c0d1::1","fd13:5d43:c0d1:0:f12b:fe1a:d894:cc03","53","63389","DNS","111","eth:ethertype:ipv6:udp:dns","111","","Standard query response 0x8543 A e9.whatsapp.net A 15.197.206.217"
"2024-06-23 21:55:19","172.16.42.1","172.16.42.196","53","63389","DNS","91","eth:ethertype:ip:udp:dns","91","","Standard query response 0x8543 A e9.whatsapp.net A 15.197.206.217"
"2024-06-23 21:55:20","172.16.42.196","15.197.206.217","51738","443","TCP","66","eth:ethertype:ip:tcp","66","","51738  >  443 [SYN] Seq=0 Win=64240 Len=0 MSS=1460 WS=256 SACK_PERM"
"2024-06-23 21:55:20","172.16.42.196","255.255.255.255","1046","1046","UDP","67","eth:ethertype:ip:udp:data","67","72635f69616d686572653a363535353a303a303a4544444945","1046  >  1046 Len=25"
"2024-06-23 21:55:20","172.16.42.196","192.168.1.101","51739","6555","TCP","66","eth:ethertype:ip:tcp","66","","51739  >  6555 [SYN] Seq=0 Win=64240 Len=0 MSS=1460 WS=256 SACK_PERM"
"2024-06-23 21:55:20","15.197.206.217","172.16.42.196","443","51738","TCP","66","eth:ethertype:ip:tcp","66","","443  >  51738 [SYN, ACK] Seq=0 Ack=1 Win=65535 Len=0 MSS=1460 SACK_PERM WS=256"
"2024-06-23 21:55:20","172.16.42.196","15.197.206.217","51738","443","TCP","60","eth:ethertype:ip:tcp","60","","51738  >  443 [ACK] Seq=1 Ack=1 Win=131328 Len=0"
"2024-06-23 21:55:20","172.16.42.196","15.197.206.217","51738","443","SSL","319","eth:ethertype:ip:tcp:tls","319","","Continuation Data"
"2024-06-23 21:55:20","15.197.206.217","172.16.42.196","443","51738","TCP","54","eth:ethertype:ip:tcp","54","","443  >  51738 [ACK] Seq=1 Ack=266 Win=66816 Len=0"
"2024-06-23 21:55:20","15.197.206.217","172.16.42.196","443","51738","TCP","54","eth:ethertype:ip:tcp","54","","443  >  51738 [FIN, ACK] Seq=1 Ack=266 Win=66816 Len=0"
"2024-06-23 21:55:20","172.16.42.196","15.197.206.217","51738","443","TCP","60","eth:ethertype:ip:tcp","60","","51738  >  443 [ACK] Seq=266 Ack=2 Win=131328 Len=0"
"2024-06-23 21:55:20","172.16.42.196","15.197.206.217","51738","443","TCP","60","eth:ethertype:ip:tcp","60","","51738  >  443 [FIN, ACK] Seq=266 Ack=2 Win=131328 Len=0"
"2024-06-23 21:55:20","172.16.42.196","157.240.229.60","51436","443","TCP","60","eth:ethertype:ip:tcp","60","","[TCP Retransmission] 51436  >  443 [FIN, ACK] Seq=1 Ack=1 Win=1023 Len=0"
"2024-06-23 21:55:20","15.197.206.217","172.16.42.196","443","51738","TCP","54","eth:ethertype:ip:tcp","54","","[TCP Out-Of-Order] 443  >  51738 [FIN, ACK] Seq=1 Ack=266 Win=66816 Len=0"
"2024-06-23 21:55:20","172.16.42.196","15.197.206.217","51738","443","TCP","60","eth:ethertype:ip:tcp","60","","[TCP Dup ACK 195#1] 51738  >  443 [ACK] Seq=267 Ack=2 Win=131328 Len=0"
"2024-06-23 21:55:20","15.197.206.217","172.16.42.196","443","51738","TCP","54","eth:ethertype:ip:tcp","54","","443  >  51738 [ACK] Seq=2 Ack=267 Win=66816 Len=0"
"2024-06-23 21:55:20","15.197.206.217","172.16.42.196","443","51738","TCP","54","eth:ethertype:ip:tcp","54","","[TCP Dup ACK 200#1] 443  >  51738 [ACK] Seq=2 Ack=267 Win=66816 Len=0"
"2024-06-23 21:55:21","172.16.42.196","255.255.255.255","1046","1046","UDP","67","eth:ethertype:ip:udp:data","67","72635f69616d686572653a363535353a303a303a4544444945","1046  >  1046 Len=25"
"2024-06-23 21:55:21","172.16.42.196","192.168.1.101","51741","6555","TCP","66","eth:ethertype:ip:tcp","66","","51741  >  6555 [SYN] Seq=0 Win=64240 Len=0 MSS=1460 WS=256 SACK_PERM"
"2024-06-23 21:55:21","172.16.42.196","3.33.221.48","51742","5222","TCP","66","eth:ethertype:ip:tcp","66","","51742  >  5222 [SYN] Seq=0 Win=64240 Len=0 MSS=1460 WS=256 SACK_PERM"
"2024-06-23 21:55:21","fd13:5d43:c0d1:0:f12b:fe1a:d894:cc03","fd13:5d43:c0d1::1","49767","53","DNS","98","eth:ethertype:ipv6:udp:dns","98","","Standard query 0x429a A www.googleapis.com"
"2024-06-23 21:55:21","fd13:5d43:c0d1:0:f12b:fe1a:d894:cc03","fd13:5d43:c0d1::1","53274","53","DNS","98","eth:ethertype:ipv6:udp:dns","98","","Standard query 0x342e AAAA www.googleapis.com"
"2024-06-23 21:55:21","fd13:5d43:c0d1::1","fd13:5d43:c0d1:0:f12b:fe1a:d894:cc03","53","49767","DNS","338","eth:ethertype:ipv6:udp:dns","338","","Standard query response 0x429a A www.googleapis.com A 142.251.132.106 A 142.250.78.10 A 142.250.218.106 A 142.250.78.42 A 142.250.218.138 A 142.250.78.106 A 142.250.78.74 A 142.250.78.170 A 142.250.78.138 A 142.251.132.74 A 172.217.173.42 A 172.217.30.202 A 172.217.28.106 A 142.251.135.170 A 142.251.132.138"
"2024-06-23 21:55:21","172.16.42.196","172.16.42.1","53274","53","DNS","78","eth:ethertype:ip:udp:dns","78","","Standard query 0x342e AAAA www.googleapis.com"
"2024-06-23 21:55:21","fd13:5d43:c0d1::1","fd13:5d43:c0d1:0:f12b:fe1a:d894:cc03","53","53274","DNS","210","eth:ethertype:ipv6:udp:dns","210","","Standard query response 0x342e AAAA www.googleapis.com AAAA 2800:3f0:4005:40f::200a AAAA 2800:3f0:4005:40e::200a AAAA 2800:3f0:4005:403::200a AAAA 2800:3f0:4005:40d::200a"
"2024-06-23 21:55:21","172.16.42.1","172.16.42.196","53","53274","DNS","190","eth:ethertype:ip:udp:dns","190","","Standard query response 0x342e AAAA www.googleapis.com AAAA 2800:3f0:4005:40f::200a AAAA 2800:3f0:4005:40e::200a AAAA 2800:3f0:4005:403::200a AAAA 2800:3f0:4005:40d::200a"
"2024-06-23 21:55:21","172.16.42.196","142.251.132.106","51743","443","TCP","66","eth:ethertype:ip:tcp","66","","51743  >  443 [SYN] Seq=0 Win=64240 Len=0 MSS=1460 WS=256 SACK_PERM"
"2024-06-23 21:55:21","142.251.132.106","172.16.42.196","443","51743","TCP","66","eth:ethertype:ip:tcp","66","","443  >  51743 [SYN, ACK] Seq=0 Ack=1 Win=65535 Len=0 MSS=1412 SACK_PERM WS=256"
"2024-06-23 21:55:21","172.16.42.196","142.251.132.106","51743","443","TCP","60","eth:ethertype:ip:tcp","60","","51743  >  443 [ACK] Seq=1 Ack=1 Win=131072 Len=0"
"2024-06-23 21:55:21","172.16.42.196","142.251.132.106","51743","443","TLSv1.3","332","eth:ethertype:ip:tcp:tls","332","","Client Hello (SNI=www.googleapis.com)"
"2024-06-23 21:55:21","142.251.132.106","172.16.42.196","443","51743","TCP","54","eth:ethertype:ip:tcp","54","","443  >  51743 [ACK] Seq=1 Ack=279 Win=66816 Len=0"
"2024-06-23 21:55:21","142.251.132.106","172.16.42.196","443","51743","TLSv1.3","1466","eth:ethertype:ip:tcp:tls","1466","","Server Hello, Change Cipher Spec"
"2024-06-23 21:55:21","142.251.132.106","172.16.42.196","443","51743","TCP","1466","eth:ethertype:ip:tcp","1466","","443  >  51743 [PSH, ACK] Seq=1413 Ack=279 Win=66816 Len=1412 [TCP segment of a reassembled PDU]"
"2024-06-23 21:55:21","142.251.132.106","172.16.42.196","443","51743","TCP","317","eth:ethertype:ip:tcp","317","","[TCP Previous segment not captured] 443  >  51743 [PSH, ACK] Seq=4237 Ack=279 Win=66816 Len=263 [TCP segment of a reassembled PDU]"
"2024-06-23 21:55:21","142.251.132.106","172.16.42.196","443","51743","TCP","1466","eth:ethertype:ip:tcp","1466","","[TCP Out-Of-Order] 443  >  51743 [ACK] Seq=2825 Ack=279 Win=66816 Len=1412"
"2024-06-23 21:55:21","172.16.42.196","142.251.132.106","51743","443","TCP","60","eth:ethertype:ip:tcp","60","","51743  >  443 [ACK] Seq=279 Ack=2825 Win=131072 Len=0"
"2024-06-23 21:55:21","172.16.42.196","142.251.132.106","51743","443","TCP","66","eth:ethertype:ip:tcp","66","","[TCP Dup ACK 220#1] 51743  >  443 [ACK] Seq=279 Ack=2825 Win=131072 Len=0 SLE=4237 SRE=4500"
"2024-06-23 21:55:21","172.16.42.196","142.251.132.106","51743","443","TCP","60","eth:ethertype:ip:tcp","60","","51743  >  443 [ACK] Seq=279 Ack=4500 Win=131072 Len=0"
"2024-06-23 21:55:21","172.16.42.196","142.251.132.106","51743","443","TLSv1.3","134","eth:ethertype:ip:tcp:tls","134","","Change Cipher Spec, Application Data"
"2024-06-23 21:55:21","142.251.132.106","172.16.42.196","443","51743","TCP","54","eth:ethertype:ip:tcp","54","","443  >  51743 [ACK] Seq=4500 Ack=359 Win=66816 Len=0"
"2024-06-23 21:55:21","172.16.42.196","142.251.132.106","51743","443","TLSv1.3","1179","eth:ethertype:ip:tcp:tls","1179","","Application Data"
